method_id	run_id	seed	commit	validation_loss	n_runs	validation_loss_mean	validation_loss_std	delta	p_at_l	train_loss	training_seconds	actual_steps	model_tokens_M	params_M	memory_GB	evaluation_seconds	status	description
r27_cwd	r27_cwd-seed42-kn081-20260906T175504Z	42	NA	2.5987412109971046	2	2.599075138568878	0.0004722449008524399	-0.008122719824314117	0.09249408040267994	2.6438844442367553	3600.238950729836	11014	665.997433	142.359616	17.111530780792236	313.19032518332824	discard	Muon-only cautious weight decay: gate decay by pre-update weight times native orthogonalized update >=0; retain all R22 momentum/NS/shape scaling, AdamW groups,142359616-parameter model, batch256 and sqrt-count MLM.
r27_cwd	r27_cwd-seed43-kn056-20260906T175504Z	43	NA	2.5994090661406517	2	2.599075138568878	0.0004722449008524399	-0.008122719824314117	0.09830363228310703	2.646044704914093	3600.124406354036	10959	663.023793	142.359616	17.080778121948242	252.31663672905415	discard	Muon-only cautious weight decay: gate decay by pre-update weight times native orthogonalized update >=0; retain all R22 momentum/NS/shape scaling, AdamW groups,142359616-parameter model, batch256 and sqrt-count MLM.
r28_ema	r28_ema-seed42-kn081-20260906T192318Z	42	NA	2.5787397138774395	2	2.584854794666171	0.008648030186431356	0.0060976240783929825	0.10907910386529514	2.643080554008484	3600.295399359893	11060	668.780038	142.359616	17.63269329071045	258.1966576660052	discard	Evaluate predeclared EMA weights: initialize after warmup step554, decay0.999 every later update within the hour; preserve online R22 model/Muon+AdamW, batch256 and sqrt-count MLM, retain online weights with optimizer state.
r28_ema	r28_ema-seed43-kn056-20260906T192318Z	43	NA	2.5909698754549026	2	2.584854794666171	0.008648030186431356	0.0060976240783929825	0.10563076491962989	2.6457286143302916	3600.2435569376685	11100	671.53381	142.359616	17.601140022277832	240.28135050274432	discard	Evaluate predeclared EMA weights: initialize after warmup step554, decay0.999 every later update within the hour; preserve online R22 model/Muon+AdamW, batch256 and sqrt-count MLM, retain online weights with optimizer state.
r29_tied	r29_tied-seed42-kn081-20260906T204223Z	42	NA	2.584416225552559	2	2.580568107776344	0.005442060348732356	0.010384310968220234	0.09017804768897014	2.6410908794403074	3600.193862488959	11160	674.846645	142.310464	17.110797882080078	252.23476560087875	keep	Tie input embedding and output vocabulary projection after unchanged initialization; one AdamW-owned64x768 parameter receives both gradients, separate output bias and R22 FFN1536/model/optimizer/batch256/sqrt-count MLM remain.
r29_tied	r29_tied-seed43-kn056-20260906T204223Z	43	NA	2.5767199900001287	2	2.580568107776344	0.005442060348732356	0.010384310968220234	0.10035763870166096	2.645231456756592	3600.2068086382933	11129	673.284777	142.310464	17.080045223236084	254.33713495964184	keep	Tie input embedding and output vocabulary projection after unchanged initialization; one AdamW-owned64x768 parameter receives both gradients, separate output bias and R22 FFN1536/model/optimizer/batch256/sqrt-count MLM remain.
