method_id	run_id	seed	commit	validation_loss	n_runs	validation_loss_mean	validation_loss_std	delta	p_at_l	train_loss	training_seconds	actual_steps	model_tokens_M	params_M	memory_GB	evaluation_seconds	status	description
baseline	baseline-seed42-kn081-20260905T063254Z	42	c2db915f2f6870a25254402b284cb945159c8f74	2.62947016954422	2	2.6386804580688477	0.013025314944897757	0.0	0.10070865962196426	2.693044114112854	3600.29335458111	10599	640.861176	170.671168	22.376580715179443	255.2208855370991	baseline	Original ESMC-171M, AdamW, LayerNorm, default residuals/init; independent full-hour seeds 42 and 43.
baseline	baseline-seed43-kn056-20260905T063254Z	43	c2db915f2f6870a25254402b284cb945159c8f74	2.6478907465934753	2	2.6386804580688477	0.013025314944897757	0.0	0.09225794583513981	2.6998350644111633	3600.3022633739747	10546	638.029608	170.671168	22.392111778259277	191.30309449182823	baseline	Original ESMC-171M, AdamW, LayerNorm, default residuals/init; independent full-hour seeds 42 and 43.
r01_muon	r01_muon-seed42-kn081-20260905T074614Z	42	NA	2.624758470803499	2	2.6180727872997522	0.009454984284733061	0.02060767076909542	0.09661221556083431	2.6697018933296204	3600.264638945926	9635	582.567767	170.671168	21.48601531982422	436.0066445642151	keep	Hybrid Muon alone on original ESMC-171M; shared LR/WD scales 1, RMS matching, NS=5, momentum=.95.
r01_muon	r01_muon-seed43-kn056-20260905T074614Z	43	NA	2.6113871037960052	2	2.6180727872997522	0.009454984284733061	0.02060767076909542	0.0992818447672858	2.6655114316940307	3600.349717363715	9609	581.293546	170.671168	21.75391721725464	252.2065976629965	keep	Hybrid Muon alone on original ESMC-171M; shared LR/WD scales 1, RMS matching, NS=5, momentum=.95.
r02_rmsnorm	r02_rmsnorm-seed42-kn081-20260905T085726Z	42	NA	2.6085998192429543	2	2.616552331484854	0.011246550667433	0.001520455814898014	0.1036218200537681	2.667067036628723	3600.084749290254	10238	619.045755	170.559808	21.733322620391846	267.9749175407924	discard	Parameter-free transformer RMSNorm alone on retained hybrid Muon.
r02_rmsnorm	r02_rmsnorm-seed43-kn056-20260905T085726Z	43	NA	2.624504843726754	2	2.616552331484854	0.011246550667433	0.001520455814898014	0.0991815478881813	2.6717085814476014	3600.1817279141396	10207	617.466485	170.559808	21.739909648895264	259.20247074682266	discard	Parameter-free transformer RMSNorm alone on retained hybrid Muon.
r03_tokenmean	r03_tokenmean-seed42-kn081-20260905T101433Z	42	NA	2.6022557988762856	2	2.6088647805154324	0.00934651146755618	0.009208006784319878	0.11212684567856275	2.654069519042969	3600.3242070032284	9633	582.446392	170.671168	21.486016273498535	273.9966182918288	discard	Global token-mean MLM objective on R01; sequence-mean diagnostics and evaluation fixed.
r03_tokenmean	r03_tokenmean-seed43-kn056-20260905T101433Z	43	NA	2.615473762154579	2	2.6088647805154324	0.00934651146755618	0.009208006784319878	0.1070221831730501	2.650487675666809	3600.1884985477664	9671	585.053621	170.671168	21.753918170928955	225.3482087943703	discard	Global token-mean MLM objective on R01; sequence-mean diagnostics and evaluation fixed.
r04_batchbalance	r04_batchbalance-seed42-kn081-20260905T113247Z	42	NA	2.5995532013475895	2	2.6041505374014378	0.006501614998139024	0.013922249898314476	0.09560949812257497	2.659829168319702	3600.080524172634	10396	628.605445	170.671168	18.827134609222412	412.07769611803815	keep	Balance the same masked examples across DDP ranks; model and sequence-mean loss unchanged.
r04_batchbalance	r04_batchbalance-seed43-kn056-20260905T113247Z	43	NA	2.608747873455286	2	2.6041505374014378	0.006501614998139024	0.013922249898314476	0.09178944972741465	2.6589782524108885	3600.3312047100626	10339	625.485368	170.671168	19.043936252593994	257.1430572690442	keep	Balance the same masked examples across DDP ranks; model and sequence-mean loss unchanged.
r05_depthinit	r05_depthinit-seed42-kn081-20260905T125132Z	42	NA	2.6007565408945084	2	2.6163447815924883	0.022045101408619455	-0.01219424419105053	0.10223602233487235	2.6592971086502075	3600.3141882722266	10379	627.567674	170.671168	18.827134609222412	234.30130214011297	discard	Depth-scaled residual projection initialization on accepted Muon plus balanced batches.
r05_depthinit	r05_depthinit-seed43-kn056-20260905T125132Z	43	NA	2.631933022290468	2	2.6163447815924883	0.022045101408619455	-0.01219424419105053	0.10107968960834805	2.658982651233673	3600.1698706340976	10351	626.214791	170.671168	19.043936252593994	254.36580878449604	discard	Depth-scaled residual projection initialization on accepted Muon plus balanced batches.
r06_splitqkv	r06_splitqkv-seed42-kn081-20260905T140949Z	42	NA	2.6185063757002354	2	2.6225145123898983	0.005668361266366521	-0.01836397498846054	0.0961745802822237	2.658048846721649	3600.2892362843268	9821	593.827518	170.671168	18.827134609222412	256.0611662887968	discard	Independent Q/K/V Muon orthogonalization with fused model and optimizer storage on R04.
r06_splitqkv	r06_splitqkv-seed43-kn056-20260905T140949Z	43	NA	2.6265226490795612	2	2.6225145123898983	0.005668361266366521	-0.01836397498846054	0.08376809528865857	2.6617181134223937	3600.148000386078	9793	592.414059	170.671168	19.043936252593994	225.06193951051682	discard	Independent Q/K/V Muon orthogonalization with fused model and optimizer storage on R04.
r07_maskcount	r07_maskcount-seed42-kn081-20260905T153016Z	42	NA	2.6133114770054817	2	2.6160206384956837	0.0038313329221025027	-0.01187010109424591	0.10214500196311922	2.657855603694916	3600.160556882154	10384	627.879742	170.671168	18.827134609222412	420.042773257941	discard	Stochastically rounded target counts with preserved expected masking and sequence-mean loss on R04.
r07_maskcount	r07_maskcount-seed43-kn056-20260905T153016Z	43	NA	2.6187297999858856	2	2.6160206384956837	0.0038313329221025027	-0.01187010109424591	0.09431551482731262	2.657810926437378	3600.219431005884	10332	625.058478	170.671168	19.043936252593994	465.009575618431	discard	Stochastically rounded target counts with preserved expected masking and sequence-mean loss on R04.
r08_residual	r08_residual-seed42-kn081-20260905T164603Z	42	NA	2.6074235662817955	2	2.6096899500116706	0.0032051506083310703	-0.00553941261023283	0.10070740259556216	2.667121865749359	3600.332228972111	9545	577.136794	170.671216	20.00888156890869	274.09339543804526	discard	Learned per-layer running-stream and initial-embedding routes on accepted R04.
r08_residual	r08_residual-seed43-kn056-20260905T164603Z	43	NA	2.6119563337415457	2	2.6096899500116706	0.0032051506083310703	-0.00553941261023283	0.09994096819513408	2.6667118859291077	3600.215102941729	9444	571.360267	170.671216	20.23812484741211	456.0468042641878	discard	Learned per-layer running-stream and initial-embedding routes on accepted R04.
r09_context	r09_context-seed42-kn081-20260905T180249Z	42	NA	2.6034652069211006	2	2.6125364545732737	0.012828681457348213	-0.0083859171718359	0.07773831406920009	2.654574842453003	3600.144635313656	12668	615.437781	170.671168	18.94414186477661	250.0570472101681	discard	Continuous-stream context curriculum: 900 seconds at 128, then 512, with fixed LR schedule on R04.
r09_context	r09_context-seed43-kn056-20260905T180249Z	43	NA	2.6216077022254467	2	2.6125364545732737	0.012828681457348213	-0.0083859171718359	0.08922287298656473	2.6655976462364195	3600.115465672221	12663	614.836529	170.671168	18.87424325942993	260.04638772364706	discard	Continuous-stream context curriculum: 900 seconds at 128, then 512, with fixed LR schedule on R04.
r10_sqrtloss	r10_sqrtloss-seed42-kn081-20260905T192728Z	42	NA	2.5902860425412655	2	2.5943719316273928	0.005778319759953412	0.00977860577404499	0.10791944170645766	2.646664769649506	3600.2871268079616	10387	628.061636	170.671168	18.82713556289673	254.0519507434219	keep	Square-root masked-target-count weighting of sequence NLL, globally normalized; original sequence-mean diagnostic on R04.
r10_sqrtloss	r10_sqrtloss-seed43-kn056-20260905T192728Z	43	NA	2.59845782071352	2	2.5943719316273928	0.005778319759953412	0.00977860577404499	0.10274424536456686	2.644200019836426	3600.0578794130124	10328	624.81884	170.671168	19.04393720626831	451.00576111255214	keep	Square-root masked-target-count weighting of sequence NLL, globally normalized; original sequence-mean diagnostic on R04.
r11_mask20	r11_mask20-seed42-kn081-20260905T204321Z	42	NA	2.5891935601830482	2	2.5939743667840958	0.006761081534284215	0.0003975648432970047	0.10704054534234746	2.6507987546920777	3600.2033790191635	10368	626.905599	170.671168	18.82716655731201	270.0235298983753	discard	Training-only 20% Bernoulli mask density with original force-one mask-all corruption on accepted R10 sqrt loss.
r11_mask20	r11_mask20-seed43-kn056-20260905T204321Z	43	NA	2.5987551733851433	2	2.5939743667840958	0.006761081534284215	0.0003975648432970047	0.09852292353444607	2.649727873802185	3600.043831939809	10319	624.272331	170.671168	19.04393720626831	240.0914865550585	discard	Training-only 20% Bernoulli mask density with original force-one mask-all corruption on accepted R10 sqrt loss.
r12_headnorm	r12_headnorm-seed42-kn081-20260905T220047Z	42	NA	2.597066130489111	2	2.597021931782365	6.250641051968778e-05	-0.0026500001549720764	0.11161040132670207	2.6475751185417176	3600.3501402428374	9794	592.173248	170.671168	21.257095336914062	231.36674222024158	discard	Per-head Q/K LayerNorm statistics with unchanged per-channel gains and attention scale on accepted R10.
r12_headnorm	r12_headnorm-seed43-kn056-20260905T220047Z	43	NA	2.5969777330756187	2	2.597021931782365	6.250641051968778e-05	-0.0026500001549720764	0.10413160251777778	2.6482248449325563	3600.147962364834	9752	589.943802	170.671168	21.5012149810791	352.0789375300519	discard	Per-head Q/K LayerNorm statistics with unchanged per-channel gains and attention scale on accepted R10.
r13_polarexpress	r13_polarexpress-seed42-kn081-20260905T232408Z	42	NA	2.582039177417755	2	2.598592324182391	0.023409684654500607	-0.004220392554998398	0.10876522007730915	2.6460794472694396	3600.261543279048	10345	625.537155	170.671168	18.82713556289673	262.0230452781543	discard	Five stabilized Polar Express orthogonalization steps in native Muon framework on accepted R10.
r13_polarexpress	r13_polarexpress-seed43-kn056-20260905T232408Z	43	NA	2.615145470947027	2	2.598592324182391	0.023409684654500607	-0.004220392554998398	0.10152549723652571	2.6441706228256225	3600.020536439959	10300	623.126214	170.671168	19.04393720626831	463.0222257836722	discard	Five stabilized Polar Express orthogonalization steps in native Muon framework on accepted R10.
r14_headgate	r14_headgate-seed42-kn081-20260906T004223Z	42	NA	2.604304561391473	2	2.6094640912488103	0.0072966770997155775	-0.015092159621417522	0.10854930696833652	2.6535282015800474	3600.252947829198	9630	582.261267	170.892352	20.03165102005005	262.04032751126215	discard	Query-dependent head output gates initialized at identity with 2*sigmoid, on accepted R10.
r14_headgate	r14_headgate-seed43-kn056-20260906T004223Z	43	NA	2.6146236211061478	2	2.6094640912488103	0.0072966770997155775	-0.015092159621417522	0.0985924071157604	2.6552809953689573	3600.342561942991	9599	580.677011	170.892352	20.260656356811523	480.15228848019615	discard	Query-dependent head output gates initialized at identity with 2*sigmoid, on accepted R10.
r15_adamuon	r15_adamuon-seed42-kn081-20260906T020514Z	42	NA	2.608914740383625	2	2.6093969102948904	0.0006818912278797226	-0.015024978667497635	0.11239782877038226	2.658961796760559	3600.3224669550546	9921	599.86685	170.671168	19.4671630859375	235.36683277133852	discard	AdaMuon v3 sign-stabilized, variance-adaptive RMS-aligned updates on accepted R10; native NS5 and fp32 second moments.
r15_adamuon	r15_adamuon-seed43-kn056-20260906T020514Z	43	NA	2.6098790802061558	2	2.6093969102948904	0.0006818912278797226	-0.015024978667497635	0.1076438517263567	2.663573079109192	3600.1467912290245	9874	597.337956	170.671168	19.6846022605896	266.49956167442724	discard	AdaMuon v3 sign-stabilized, variance-adaptive RMS-aligned updates on accepted R10; native NS5 and fp32 second moments.
r16_geglu	r16_geglu-seed42-kn081-20260906T032028Z	42	NA	2.5903162509202957	2	2.6013420447707176	0.015592827199196527	-0.006970113143324852	0.11062270811494453	2.6472403144836427	3600.2269445690326	10366	626.784418	170.671168	18.82713556289673	268.98023285903037	discard	GEGLU replaces SwiGLU in all 24 FFNs with identical matrices and initialization on accepted R10.
r16_geglu	r16_geglu-seed43-kn056-20260906T032028Z	43	NA	2.6123678386211395	2	2.6013420447707176	0.015592827199196527	-0.006970113143324852	0.10235221509343505	2.6450966095924375	3600.357679302804	10349	626.093633	170.671168	19.04393720626831	378.3904860392213	discard	GEGLU replaces SwiGLU in all 24 FFNs with identical matrices and initialization on accepted R10.
r17_muonscale	r17_muonscale-seed42-kn081-20260906T043559Z	42	NA	2.579673022031784	2	2.5908984672278166	0.0158751768399051	0.003473464399576187	0.10516094944375481	2.644584357738495	3600.036589389667	10375	627.332485	170.671168	18.82713556289673	240.98081444203854	discard	Double native Muon update amplitude while preserving per-step weight shrinkage and AdamW rates on accepted R10.
r17_muonscale	r17_muonscale-seed43-kn056-20260906T043559Z	43	NA	2.602123912423849	2	2.5908984672278166	0.0158751768399051	0.003473464399576187	0.10022758362063318	2.643554298877716	3600.3018460269086	10339	625.485368	170.671168	19.04393720626831	268.12017977796495	discard	Double native Muon update amplitude while preserving per-step weight shrinkage and AdamW rates on accepted R10.
r18_tokendrop	r18_tokendrop-seed42-kn081-20260906T055353Z	42	NA	2.579772222787142	2	2.591290893033147	0.01628985968240379	0.0030810385942459106	0.10803366055835385	2.6475074005126955	3600.268575305119	10363	626.610769	170.671168	18.827216625213623	447.02537436410785	discard	Apply ESM-2-style zero mask embeddings with per-sequence visible-fraction rescaling adapted to 15% mask-all corruption on accepted R10.
r18_tokendrop	r18_tokendrop-seed43-kn056-20260906T055353Z	43	NA	2.602809563279152	2	2.591290893033147	0.01628985968240379	0.0030810385942459106	0.11281978530497391	2.643714277744293	3600.06853107037	10337	625.361198	170.671168	19.04401969909668	393.11980106681585	discard	Apply ESM-2-style zero mask embeddings with per-sequence visible-fraction rescaling adapted to 15% mask-all corruption on accepted R10.
r19_bertcorrupt	r19_bertcorrupt-seed42-kn081-20260906T071239Z	42	NA	2.6136374175548553	2	2.6157104708254337	0.0029317400507738525	-0.021338539198040962	0.10253929271035707	2.4895182061195373	3600.0736339781433	10363	626.610769	170.671168	18.827197551727295	252.98448393912986	discard	Replace the same selected MLM targets with 80% mask, 10% uniform canonical amino acid and 10% original residue using an independent RNG, on accepted R10.
r19_bertcorrupt	r19_bertcorrupt-seed43-kn056-20260906T071239Z	43	NA	2.617783524096012	2	2.6157104708254337	0.0029317400507738525	-0.021338539198040962	0.10605230938619957	2.493269908428192	3600.0182179808617	10318	624.213855	170.671168	19.043967723846436	246.27857421385124	discard	Replace the same selected MLM targets with 80% mask, 10% uniform canonical amino acid and 10% original residue using an independent RNG, on accepted R10.
r20_lastsubset	r20_lastsubset-seed42-kn081-20260906T083724Z	42	NA	2.5916405580937862	2	2.595495877787471	0.005452245398092816	-0.0011239461600780487	0.10845685666234665	2.646087830066681	3600.280378098134	10552	638.024468	170.671168	18.570623874664307	279.985049393028	discard	Compute the final FFN and prediction head only at supervised MLM positions, retaining all attention context and the accepted R10 objective.
r20_lastsubset	r20_lastsubset-seed43-kn056-20260906T083724Z	43	NA	2.5993511974811554	2	2.595495877787471	0.005452245398092816	-0.0011239461600780487	0.10507654510404775	2.6462883591651916	3600.095800722018	10494	634.866053	170.671168	18.55209732055664	272.08055010577664	discard	Compute the final FFN and prediction head only at supervised MLM positions, retaining all attention context and the accepted R10 objective.
r21_batch32	r21_batch32-seed42-kn081-20260906T095440Z	42	NA	2.601979225873947	2	2.59766005910933	0.006108224216672435	-0.0032881274819374084	0.11042849378849146	2.643323941230774	3600.1145316991024	19417	586.979363	170.671168	11.099594116210938	228.97921326337382	discard	Halve per-rank microbatch from64 to32 (global batch128), retaining accumulation1 and the accepted R10 model, loss and per-step optimizer recipe.
r21_batch32	r21_batch32-seed43-kn056-20260906T095440Z	43	NA	2.593340892344713	2	2.59766005910933	0.006108224216672435	-0.0032881274819374084	0.10023499823668175	2.652765939235687	3600.1283084377646	19376	586.05084	170.671168	11.238757133483887	263.08519431483	discard	Halve per-rank microbatch from64 to32 (global batch128), retaining accumulation1 and the accepted R10 model, loss and per-step optimizer recipe.
r22_ffn1536	r22_ffn1536-seed42-kn081-20260906T111309Z	42	NA	2.5900170989334583	2	2.590952418744564	0.0013227419620219622	0.0034195128828287125	0.09627286725924138	2.6430711913108826	3600.227919776924	11178	675.938558	142.359616	17.111530780792236	423.2899198960513	keep	Narrow all24 SwiGLU FFN hidden dimensions2048->1536 (142359616 parameters), retaining the R10 attention architecture, batch256, loss and per-step optimizer recipe.
r22_ffn1536	r22_ffn1536-seed43-kn056-20260906T111309Z	43	NA	2.59188773855567	2	2.590952418744564	0.0013227419620219622	0.0034195128828287125	0.10031101023208855	2.645797984600067	3600.031980429776	11118	672.626676	142.359616	17.080778121948242	239.49613662203774	keep	Narrow all24 SwiGLU FFN hidden dimensions2048->1536 (142359616 parameters), retaining the R10 attention architecture, batch256, loss and per-step optimizer recipe.
r23_zloss	r23_zloss-seed42-kn081-20260906T123228Z	42	NA	2.5989885218441486	2	2.5999145098030567	0.0013095447300819885	-0.00896209105849266	0.09909528677343807	2.6435548639297486	3600.1595063288696	11175	675.752976	142.359616	17.111531734466553	224.2135515427217	discard	Add1e-4 masked logit z-loss with global sqrt-mask-count sequence weighting to accepted R22; report original MLM loss separately.
r23_zloss	r23_zloss-seed43-kn056-20260906T123228Z	43	NA	2.600840497761965	2	2.5999145098030567	0.0013095447300819885	-0.00896209105849266	0.09747377421593073	2.645685837268829	3600.096719321329	11190	676.976299	142.359616	17.08077907562256	206.34731322992593	discard	Add1e-4 masked logit z-loss with global sqrt-mask-count sequence weighting to accepted R22; report original MLM loss separately.
r24_ffn1024	r24_ffn1024-seed42-kn081-20260906T134921Z	42	NA	2.5950704645365477	2	2.5981303891167045	0.00432738684109655	-0.0071779703721404076	0.09951391298248805	2.646404857635498	3600.0695681059733	12279	742.498977	114.048064	15.146510601043701	222.43516430817544	discard	Narrow all24 SwiGLU FFN hidden dimensions1536->1024 (114048064 parameters), retaining the accepted R22 attention architecture, batch256, sqrt-count MLM and optimizer recipe.
r24_ffn1024	r24_ffn1024-seed43-kn056-20260906T134921Z	43	NA	2.6011903136968613	2	2.5981303891167045	0.00432738684109655	-0.0071779703721404076	0.10551984077584066	2.6433655643463134	3600.2348521691747	12226	739.623456	114.048064	15.138411521911621	254.67367307655513	discard	Narrow all24 SwiGLU FFN hidden dimensions1536->1024 (114048064 parameters), retaining the accepted R22 attention architecture, batch256, sqrt-count MLM and optimizer recipe.
r25_ffnprofile	r25_ffnprofile-seed42-kn081-20260906T151455Z	42	NA	2.595098178833723	2	2.5941735841333866	0.001307574364914104	-0.0032211653888225555	0.10638096269821629	2.6437209129333494	3600.1749447057955	11240	679.697388	142.359616	17.10621690750122	287.2278734962456	discard	Redistribute the same total FFN width using a training-only angular-work profile: layer1=3072, layers2-7=1280, layers8-24=1536; retain142359616 parameters and accepted R22 attention, batch256, sqrt-count MLM and optimizer recipe.
r25_ffnprofile	r25_ffnprofile-seed43-kn056-20260906T151455Z	43	NA	2.59324898943305	2	2.5941735841333866	0.001307574364914104	-0.0032211653888225555	0.10379307662886174	2.644370632171631	3600.041141972877	11199	677.51619	142.359616	17.069467067718506	260.3904819767922	discard	Redistribute the same total FFN width using a training-only angular-work profile: layer1=3072, layers2-7=1280, layers8-24=1536; retain142359616 parameters and accepted R22 attention, batch256, sqrt-count MLM and optimizer recipe.
r26_valueres	r26_valueres-seed42-kn081-20260906T163327Z	42	NA	2.5971374958753586	2	2.6003530491143465	0.004547479001109455	-0.009400630369782448	0.11181480359646992	2.6403492975234983	3600.1201231358573	10917	660.137984	142.359616	15.959511280059814	256.22340472089127	discard	Identity value residual: mix first-layer and current attention values equally in layers2-24 with intact cross-layer gradients and cached first QKV; retain accepted R22 shapes,142359616 parameters, batch256, sqrt-count MLM and optimizer recipe.
r26_valueres	r26_valueres-seed43-kn056-20260906T163327Z	43	NA	2.6035686023533344	2	2.6003530491143465	0.004547479001109455	-0.009400630369782448	0.11107025250545471	2.642250292301178	3600.1737673897296	10862	657.152066	142.359616	15.936265468597412	259.42483327072114	discard	Identity value residual: mix first-layer and current attention values equally in layers2-24 with intact cross-layer gradients and cached first QKV; retain accepted R22 shapes,142359616 parameters, batch256, sqrt-count MLM and optimizer recipe.
